"New #","Old #","Origin","Domain","Type","Source","Grouping","Code","Description","Implemented when","Responsible actor"
"1","1","Academia","GDPR compliance verification","Measure","Chhetri et al. (2022)","Security","Security activities","In order to adhere to the purpose limitation principle, role concepts with graduated access rights on the basis of identity management and a secure authentication process are implemented.","N/A","N/A"
"2","2","Academia","GDPR compliance verification","Measure","Chhetri et al. (2022)","Data processing principles","Storage limitation","In order to adhere to the storage limitation principle, the data syntax are documented.","N/A","N/A"
"3","3","Academia","GDPR compliance verification","Measure","Chhetri et al. (2022)","Lawfulness, fairness, and transparency","Consent","In order to adhere to the lawfulness, fairness, and transparency principle, consents, their revocations and objections are documented.","N/A","N/A"
"4","6","Academia","GDPR compliance verification","Measure","Chhetri et al. (2022)","Security","Security activities","In order to adhere to the integrity and confidentiality, and accountability principle, data are protected against external influences.","N/A","N/A"
"5","8","Academia","Business process redesign","Practice","Diamantopoulou & Karyda (2022)","Privacy-by-design","PbD processes","Privacy-by-design is integrated into business processes/workflows.","N/A","Business analyst"
"6","9","Academia","Business process redesign","Practice","Diamantopoulou & Karyda (2022)","Data management","Data management","Information systems are identified and kept in an inventory.","N/A","Business analyst"
"7","12","Academia","Business process redesign","Practice","Diamantopoulou & Karyda (2022)","Processing activity","Data identification & classification","Assets that contain personal data are identified and kept in an inventory. ","N/A","Security/privacy expert"
"8","15","Academia","Business process redesign","Practice","Diamantopoulou & Karyda (2022)","Security","Security activities","Existing security mechanisms are identified and kept in an inventory.","N/A","Security/privacy expert"
"9","20","Academia","Business process redesign","Practice","Diamantopoulou & Karyda (2022)","PIA/DPIA","PIA component","Risk source capabilities are described.","N/A","Security/privacy expert or business analyst"
"10","21","Academia","Business process redesign","Practice","Diamantopoulou & Karyda (2022)","PIA/DPIA","PIA component","Feared events are identified.","N/A","Security/privacy expert or business analyst"
"11","26","Academia","Business process redesign","Practice","Diamantopoulou & Karyda (2022)","PIA/DPIA","PIA component","Risk levels are identified.","N/A","Security/privacy expert or business analyst"
"12","27","Academia","Business process redesign","Practice","Diamantopoulou & Karyda (2022)","PIA/DPIA","PIA component","Business processes with critical assets that concentrate high risk for potential privacy breaches are identified.","N/A","Business analyst"
"13","30","Academia","Business process redesign","Practice","Diamantopoulou & Karyda (2022)","PIA/DPIA","PIA component","The processing activities are identified.","During DPIA process","Analyst"
"14","33","Academia","Business process redesign","Practice","Diamantopoulou & Karyda (2022)","PIA/DPIA","PIA component","Mitigation measures are identified in terms of applicable privacy patterns.","During DPIA process","Analyst"
"15","37","Academia","Privacy/data protection-by-design","Practice","Pedroza et al. (2021)","PIA/DPIA","PIA component","The risks of personal data being linked with external data sources are identified.","During design phase","N/A"
"16","38","Academia","Privacy/data protection-by-design","Practice","Pedroza et al. (2021)","Data management","Data management","The data structures are modelled in a data-oriented model.","During design phase","N/A"
"17","40","Academia","Privacy/data protection-by-design","Practice","Pedroza et al. (2021)","System engineering","Architecture","The data flows are mapped over the architecture in an architecture model.","During architecture design","N/A"
"18","42","Academia","DPIA","Practice","Timón López (2021)","Privacy-by-design","Requirements","Privacy requirements are formulated before the design stage.","During the requirements stage","N/A"
"19","43","Academia","DPIA","Practice","Timón López (2021)","System engineering","Architecture","Architecture design is based on the privacy requirements.","During architecture design","N/A"
"20","44","Academia","DPIA","Practice","Timón López (2021)","System engineering","Architecture","The architecture is validated to confirm that privacy requirements are correctly implemented.","During architecture design","N/A"
"21","45","Academia","DPIA","Practice","Timón López (2021)","PIA/DPIA","PIA component","The DPIA describes the scope of study.","During DPIA process","N/A"
"22","46","Academia","DPIA","Practice","Timón López (2021)","PIA/DPIA","PIA component","The DPIA describes the technology characteristics of the technological proposal.","During DPIA process","N/A"
"23","48","Academia","DPIA","Recommendation","Timón López (2021)","PIA/DPIA","PIA report","The DPIA contains graphical representations of the architecture design.","During DPIA process","N/A"
"24","49","Academia","DPIA","Practice","Timón López (2021)","PIA/DPIA","PIA process & support","The DPIA is understandable for technical and non-technical experts.","During DPIA process","N/A"
"25","53","Academia","DPIA","Practice","Timón López (2021)","PIA/DPIA","PIA component","The DPIA describes the risks by multiplying the likelihood and the impact.","During DPIA process","N/A"
"26","54","Academia","DPIA","Practice","Timón López (2021)","PIA/DPIA","PIA component","The DPIA classifies each threat according to a level of risk.","During DPIA process","N/A"
"27","57","Academia","DPIA","Recommendation","Timón López (2021)","PIA/DPIA","PIA component","The DPIA evaluates whether the measures can achieve the proposed processing objective.","During DPIA process","N/A"
"28","58","Academia","DPIA","Recommendation","Timón López (2021)","PIA/DPIA","PIA component","The DPIA evaluates whether more moderate measure can achieve the proposed processing objective with the same effectiveness.","During DPIA process","N/A"
"29","59","Academia","DPIA","Recommendation","Timón López (2021)","PIA/DPIA","PIA component","The DPIA evaluates whether the measures imply more benefits than damages for other assets or values.","During DPIA process","N/A"
"30","60","Academia","Privacy-by-design","Practice","Drev & Delak (2021)","System engineering","System development","Designs are reviewed for adherence to the basic principles of the GDPR.","N/A","N/A"
"31","63","Academia","Privacy-by-design","Practice","Drev & Delak (2021)","Lawfulness, fairness, and transparency","Transparency","The transparency of data processing is ensured.","N/A","N/A"
"32","65","Academia","Privacy-by-design","Practice","Drev & Delak (2021)","Privacy-by-design","Privacy-by-design","Organisational and technical measures for data protection are implemented.","N/A","N/A"
"33","67","Academia","Privacy-by-design","Practice","Drev & Delak (2021)","Security","Security activities","Security audit measures are implemented.","N/A","N/A"
"34","70","Academia","Privacy-by-design in IS","Practice","Arfaoui et al. (2020)","Organisational privacy awareness","Stakeholders","Stakeholders are identified.","N/A","N/A"
"35","74","Academia","Privacy-by-design in IS","Practice","Arfaoui et al. (2020)","Threat management","Threat management","Threat remediation strategies are determined.","N/A","N/A"
"36","75","Academia","Privacy-by-design in IS","Practice","Arfaoui et al. (2020)","System engineering","Strategies, tactics, & patterns","Implementation techniques in line with the strategies are chosen and implemented.","N/A","N/A"
"37","77","Academia","PbD in medical applications","Practice","Kalloniatis et al (2020)","Data management","Data subject identification","The categories of the data subjects are identified and documented.","During data process elicitation","N/A"
"38","79","Academia","PbD in medical applications","Practice","Kalloniatis et al (2020)","Processing activity","Processing activity","High risk data processing activities are identified and documented.","During data process elicitation","N/A"
"39","81","Academia","PbD in medical applications","Practice","Kalloniatis et al (2020)","Processing activity","Processing activity","The categories of recipients to whom the personal data are disclosed are identified and documented.","During data process elicitation","N/A"
"40","84","Academia","PbD in medical applications","Practice","Kalloniatis et al (2020)","Processing activity","Processing activity","A GDPR gap analysis is performed by reviewing each personal data processing category against the GDPR requirements.","N/A","N/A"
"41","85","Academia","PbD in medical applications","Practice","Kalloniatis et al (2020)","Threat management","Threat management","Security and privacy threats are identified along with the specific vulnerabilities and/or potential failures that may cause them.","During requirements elicitation","N/A"
"42","88","Academia","PbD in medical applications","Practice","Kalloniatis et al (2020)","Privacy-by-design","Requirements","All security and privacy requirements are collected and validated for technical soundness and implementation viability.","During requirements elicitation","N/A"
"43","89","Academia","PbD in medical applications","Practice","Kalloniatis et al (2020)","PIA/DPIA","PIA process & support","A data protection impact assessment (DPIA) method will be applied.","During DPIA process","N/A"
"44","94","Academia","PbD in medical applications","Practice","Kalloniatis et al (2020)","PIA/DPIA","PIA component","The DPIA considers both  legal requirements and  the technical security and privacy requirements.","During DPIA process","N/A"
"45","99","Academia","Model-based PbD","Practice","Piras et al. (2020)","Data management","Data management","All data assets are identified and documented.","N/A","Business analyst"
"46","100","Academia","Model-based PbD","Recommendation","Piras et al. (2020)","System engineering","System development","Analyses are supported by graphical representations and models.","N/A","Business analyst"
"47","102","Academia","Model-based PbD","Practice","Piras et al. (2020)","Security","Breach/incident management","Data assets that can be affected by data issues/breaches are identified.","N/A","Privacy/security analyst"
"48","105","Academia","Model-based PbD","Practice","Piras et al. (2020)","Privacy-by-design","Privacy-by-Design","Privacy/security analyses are supported by GDPR patterns and modelling techniques.","N/A","Privacy/security analyst"
"49","107","Academia","Model-based PbD","Practice","Piras et al. (2020)","Privacy-by-design","Requirements","Privacy/security requirements constraints are identified and documented.","N/A","Privacy/security analyst"
"50","112","Academia","GDPR requirements","Privacy property","Huth & Matthes (2019)","Data processing principles","Integrity & confidentiality","Integrity: protection against accidental loss, destruction or damage (GDPR).","N/A","N/A"
"51","113","Academia","GDPR requirements","Privacy property","Huth & Matthes (2019)","Data processing principles","Integrity & confidentiality","Confidentiality: Protection against unauthorized or unlawful processing (GDPR), property that information is not made available or disclosed to unauthorized individuals, entities, or processes (ISO).","N/A","N/A"
"52","114","Academia","GDPR requirements","Privacy property","Huth & Matthes (2019)","Data subject rights","Data access","Availability/Access: property of being accessible and usable on demand by an authorized entity (ISO).","N/A","N/A"
"53","120","Academia","GDPR requirements","Privacy property","Huth & Matthes (2019)","Security","Security activities","Encryption: protection measures that render data unintelligible to any person who is not authorised to access it" (GDPR).,"N/A","N/A"
"54","122","Academia","DPbD in EHR","Practice","Bincoletto (2019)","Privacy-by-design","Requirements","A gap analysis is performed to identify legal requirements.","N/A","N/A"
"55","126","Academia","DPbD in EHR","Practice","Bincoletto (2019)","Privacy-by-design","Controls","Solutions to risks take into account the state-of-the-art of the technology and implementation costs.","N/A","N/A"
"56","130","Academia","DPbD in EHR","Practice","Bincoletto (2019)","Security","Security activities","Systems are updated frequently.","N/A","N/A"
"57","131","Academia","DPbD in EHR","Practice","Bincoletto (2019)","Security","Security activities","Intrusion controls systems are in place.","N/A","N/A"
"58","132","Academia","DPbD in EHR","Practice","Bincoletto (2019)","Lawfulness, fairness, and transparency","Consent","The data controller is alerted when a data subject withdraws consent.","N/A","N/A"
"59","133","Academia","DPbD in EHR","Practice","Bincoletto (2019)","Transparent information and communication for exercise of data rights","Data subject communication","The data controller creates a privacy policy and provides all necessary information to data subjects.","N/A","N/A"
"60","134","Academia","DPbD in EHR","Practice","Bincoletto (2019)","Transparent information and communication for exercise of data rights","Data subject communication","Information provided to data subjects is transparent and easily accessible, using clear and plain language.","N/A","N/A"
"61","136","Academia","DPbD in EHR","Practice","Bincoletto (2019)","Security","Security activities","The register of authorised data access subjects should be constantly updated.","N/A","N/A"
"62","141","Academia","DPbD in EHR","Recommendation","Bincoletto (2019)","Security","Breach/incident management","An insurance policy for data breaches is formulated.","N/A","N/A"
"63","142","Academia","Extending ISO/IEC 29110 with PbD","Practice","Morales-Trujillo & García-Mireles (2018)","System engineering","System development","Identify privacy scope of software project.","Software implementation initiation","N/A"
"64","143","Academia","Extending ISO/IEC 29110 with PbD","Practice","Morales-Trujillo & García-Mireles (2018)","System engineering","System modelling","Review models for incorporating privacy in software development.","Software implementation initiation","N/A"
"65","145","Academia","Extending ISO/IEC 29110 with PbD","Practice","Morales-Trujillo & García-Mireles (2018)","Privacy-by-design","Requirements","Elicit requirements using privacy related ontologies.","Requirements analysis","N/A"
"66","147","Academia","Extending ISO/IEC 29110 with PbD","Practice","Morales-Trujillo & García-Mireles (2018)","Security","Security activities","Adapt security methods to address privacy concerns.","Requirements analysis","N/A"
"67","148","Academia","Extending ISO/IEC 29110 with PbD","Practice","Morales-Trujillo & García-Mireles (2018)","Privacy-by-design","Privacy goals","Model privacy goals in use case diagrams.","Requirements analysis","N/A"
"68","150","Academia","Extending ISO/IEC 29110 with PbD","Practice","Morales-Trujillo & García-Mireles (2018)","Privacy-by-design","Privacy goals","Apply privacy patterns to address privacy goals.","Requirements analysis","N/A"
"69","152","Academia","Extending ISO/IEC 29110 with PbD","Practice","Morales-Trujillo & García-Mireles (2018)","System engineering","Strategies, tactics, & patterns","Use a pattern to dynamically incorporate design patterns.","Software architecture and detailed design","N/A"
"70","153","Academia","Extending ISO/IEC 29110 with PbD","Practice","Morales-Trujillo & García-Mireles (2018)","System engineering","Architecture","Assess privacy capability of software architecture.","Software architecture and detailed design","N/A"
"71","155","Academia","Extending ISO/IEC 29110 with PbD","Practice","Morales-Trujillo & García-Mireles (2018)","Lawfulness, fairness, and transparency","Transparency","Apply privacy transparency patterns.","Software architecture and detailed design","N/A"
"72","156","Academia","Extending ISO/IEC 29110 with PbD","Practice","Morales-Trujillo & García-Mireles (2018)","System engineering","Architecture","Assess architecture considering data integrity.","Software construction","N/A"
"73","157","Academia","Extending ISO/IEC 29110 with PbD","Practice","Morales-Trujillo & García-Mireles (2018)","System engineering","Strategies, tactics, & patterns","Provide code excerpts to show how to implement privacy patterns.","N/A","N/A"
"74","158","Academia","Extending ISO/IEC 29110 with PbD","Practice","Morales-Trujillo & García-Mireles (2018)","Privacy-by-design","Privacy goals","Agree with Customer on a structured set of Privacy Goals.","N/A","N/A"
"75","159","Academia","Extending ISO/IEC 29110 with PbD","Practice","Morales-Trujillo & García-Mireles (2018)","Policy","Privacy policy","Define Privacy Policy together with Customer.","N/A","N/A"
"76","160","Academia","Extending ISO/IEC 29110 with PbD","Practice","Morales-Trujillo & García-Mireles (2018)","Privacy-by-design","Privacy goals","Conduct revision meetings to update Privacy Goals .","N/A","N/A"
"77","161","Academia","Extending ISO/IEC 29110 with PbD","Practice","Morales-Trujillo & García-Mireles (2018)","Policy","Privacy policy","Conduct revision meetings to update Privacy Policy.","N/A","N/A"
"78","162","Academia","Extending ISO/IEC 29110 with PbD","Practice","Morales-Trujillo & García-Mireles (2018)","PIA/DPIA","PIA component","Identify and evaluate risks associated with privacy issues together with Customer.","N/A","N/A"
"79","163","Academia","Extending ISO/IEC 29110 with PbD","Practice","Morales-Trujillo & García-Mireles (2018)","Audit, monitoring, & compliance","Auditing","Audit software for privacy.","N/A","N/A"
"80","164","Academia","Extending ISO/IEC 29110 with PbD","Practice","Morales-Trujillo & García-Mireles (2018)","Privacy-by-design","Requirements","Document or update Privacy Scenarios and their stakeholders.","N/A","N/A"
"81","165","Academia","Extending ISO/IEC 29110 with PbD","Practice","Morales-Trujillo & García-Mireles (2018)","Privacy-by-design","Requirements","Document or update Requirements Specification taking into account Privacy Scenarios.","N/A","N/A"
"82","167","Academia","Extending ISO/IEC 29110 with PbD","Practice","Morales-Trujillo & García-Mireles (2018)","Organisational privacy awareness","Roles & responsibilities","Create Role/Functionality Matrix.","N/A","N/A"
"83","168","Academia","Extending ISO/IEC 29110 with PbD","Practice","Morales-Trujillo & García-Mireles (2018)","System engineering","Architecture","Generate architectural design taking into account Privacy Scenarios.","N/A","N/A"
"84","172","Academia","Extending ISO/IEC 29110 with PbD","Practice","Morales-Trujillo & García-Mireles (2018)","Data processing principles","Accountability","Verify and obtain approval of Privacy Policy/Privacy Scenarios/Sensitive Data Dictionary/Role/Functionality Matrix.","N/A","N/A"
"85","173","Academia","Extending ISO/IEC 29110 with PbD","Practice","Morales-Trujillo & García-Mireles (2018)","Organisational privacy awareness","Roles & responsibilities","A PbD manager is assigned. Competences are: experience in data governance, familiarity with privacy protection techniques and knowledge of data privacy laws.","N/A","N/A"
"86","177","Academia","IoT Privacy-by-design","Practice","Chaudhuri & Cavoukian (2018)","System engineering","System development","Privacy enhancing capabilities are embedded in the system architecture and service design.","N/A","N/A"
"87","178","Academia","IoT Privacy-by-design","Practice","Chaudhuri & Cavoukian (2018)","Privacy-by-design","Privacy-by-Design","Privacy runs through the fabric of system and service components, providing full functionality with other key requirements like security and safety.","N/A","N/A"
"88","179","Academia","IoT Privacy-by-design","Practice","Chaudhuri & Cavoukian (2018)","Data processing principles","Storage limitation","Contextual data collected should be preserved with appropriate security and privacy measures for the entire duration of the data lifecycle and then destroyed ensuring no remanence.","N/A","N/A"
"89","181","Academia","IoT Privacy-by-design","Practice","Chaudhuri & Cavoukian (2018)","System engineering","System development","Develop the system Data Flows, Application Interfaces, Infrastructure and Network Layouts Based on Stakeholder Needs","N/A","N/A"
"90","185","Academia","IoT Privacy-by-design","Practice","Chaudhuri & Cavoukian (2018)","System engineering","System development","Build system Privacy Capabilities.","N/A","N/A"
"91","187","Academia","IoT Privacy-by-design","Practice","Chaudhuri & Cavoukian (2018)","Audit, monitoring, & compliance","Monitoring","Continuously Review Effectiveness of Privacy Controls and Identify New Privacy Risks.","N/A","N/A"
"92","188","Academia","Privacy-by-design engineering","PbD Criterion","Alshammari & Simpson (2017)","Privacy-by-design","Privacy goals","The adoption of universal privacy principles and protection goals.","N/A","N/A"
"93","189","Academia","Privacy-by-design engineering","PbD Criterion","Alshammari & Simpson (2017)","Threat management","Threat management","The adoption of the data lifecycle as a basis for the contextual analysis to identify system harmful activities in a comprehensive manner.","N/A","N/A"
"94","190","Academia","Privacy-by-design engineering","PbD Criterion","Alshammari & Simpson (2017)","Privacy-by-design","Requirements","The appropriate interpretation of stakeholders expectations and concerns into operational requirements.","N/A","N/A"
"95","191","Academia","Privacy-by-design engineering","PbD Criterion","Alshammari & Simpson (2017)","Threat management","Threat management","The adoption of an appropriate privacy threat analysis framework accompanying by impact analysis and assessment processes.","N/A","N/A"
"96","192","Academia","Privacy-by-design engineering","PbD Criterion","Alshammari & Simpson (2017)","Privacy-by-design","Controls","The specification of the required level of privacy protection.","N/A","N/A"
"97","193","Academia","Privacy-by-design engineering","PbD Criterion","Alshammari & Simpson (2017)","System engineering","Architecture","The identification of appropriate strategies for mapping privacy requirements onto software architectures.","N/A","N/A"
"98","197","Academia","PbD process patterns","Privacy property","Diamantopoulou et al. (2017)","Security","Security activities","Undetectability:  the inability for a third party to distinguish who is the user (among a set of potential users) using a service.","N/A","N/A"
"99","198","Academia","PbD process patterns","Privacy property","Diamantopoulou et al. (2017)","Security","Security activities","Unobservability: the inability of a third party to observe if a user (among a set of potential users) is using a service.","N/A","N/A"
"100","203","Academia","Privacy engineering","Practice","Notario (2015)","Privacy-by-design","Requirements","Privacy requirements are related to specific threats and/or principles to guarantee traceability and accountability.","N/A","N/A"
"101","205","Academia","Privacy-by-design","Practice","Kroener & Wright (2014)","Privacy-by-design","Privacy-by-design","Privacy-by-design adheres to a cyclical strategy involving PbD principles, a PIA process, and a menu of PETs.","N/A","N/A"
"102","208","Academia","Privacy impact assessment","Practice","Oetzel & Spiekermann (2014)","PIA/DPIA","PIA component","A PIA includes the identification of privacy targets that need to be reached through system design.","During DPIA process","N/A"
"103","209","Academia","Privacy impact assessment","Practice","Oetzel & Spiekermann (2014)","PIA/DPIA","PIA component","Privacy development targets are weighed and assigned to protection demand categories that reflect their importance in a PIA.","During DPIA process","N/A"
"104","214","Academia","Privacy impact assessment","Practice","Oetzel & Spiekermann (2014)","Privacy-by-design","Controls","Controls are evaluated for feasibility and effectiveness through a cost-benefit.","During DPIA process","N/A"
"105","215","Academia","Privacy impact assessment","Practice","Oetzel & Spiekermann (2014)","Privacy-by-design","Controls","Data controllers produce a control implementation plan that clearly identifies how each threat is mitigated and where threats remain unaddressed.","During DPIA process","N/A"
"106","217","Academia","Privacy impact assessment","Practice","Oetzel & Spiekermann (2014)","PIA/DPIA","PIA report content","PIA report contains a system overview.","N/A","N/A"
"107","218","Academia","Privacy impact assessment","Practice","Oetzel & Spiekermann (2014)","PIA/DPIA","PIA report content","PIA report contains system boundaries.","N/A","N/A"
"108","219","Academia","Privacy impact assessment","Practice","Oetzel & Spiekermann (2014)","PIA/DPIA","PIA report content","PIA report contains system purposes.","N/A","N/A"
"109","220","Academia","Privacy impact assessment","Practice","Oetzel & Spiekermann (2014)","PIA/DPIA","PIA report content","PIA report contains identified relevant privacy targets.","N/A","N/A"
"110","221","Academia","Privacy impact assessment","Practice","Oetzel & Spiekermann (2014)","PIA/DPIA","PIA report content","PIA report contains addressed relevant privacy threats.","N/A","N/A"
"111","222","Academia","Privacy impact assessment","Practice","Oetzel & Spiekermann (2014)","PIA/DPIA","PIA report content","PIA report contains chosen privacy controls.","N/A","N/A"
