"New #","Old #","Origin","Domain","Type","Source","Grouping","Code","Description","Implemented when","Responsible actor"
"112","223","Academia","Privacy impact assessment","Practice","Oetzel & Spiekermann (2014)","PIA/DPIA","PIA report content","PIA report contains encountered residual risks.","N/A","N/A"
"113","224","Academia","Privacy impact assessment","Practice","Oetzel & Spiekermann (2014)","PIA/DPIA","PIA report content","PIA report contains involved stakeholders.","N/A","N/A"
"114","225","Academia","Privacy impact assessment","Practice","Oetzel & Spiekermann (2014)","PIA/DPIA","PIA report content","PIA report contains checked legal compliance.","N/A","N/A"
"115","226","Academia","Privacy impact assessment","Practice","Oetzel & Spiekermann (2014)","PIA/DPIA","PIA report content","PIA report contains PIA start data/system's start date.","N/A","N/A"
"116","227","Academia","Privacy impact assessment","Practice","Oetzel & Spiekermann (2014)","PIA/DPIA","PIA report content","PIA report contains person(s) involved in the PIA.","N/A","N/A"
"117","228","Academia","Privacy impact assessment","Practice","Oetzel & Spiekermann (2014)","PIA/DPIA","PIA report content","PIA report contains the organisation who conducted the PIA.","N/A","N/A"
"118","229","Academia","Privacy impact assessment","Practice","Oetzel & Spiekermann (2014)","PIA/DPIA","PIA report content","PIA report contains person who approved the PIA.","N/A","N/A"
"119","230","Academia","Privacy impact assessment","Practice","Oetzel & Spiekermann (2014)","PIA/DPIA","PIA report content","PIA report contains who is responsible for privacy in the organisation.","N/A","N/A"
"120","231","Academia","Privacy impact assessment","Practice","Oetzel & Spiekermann (2014)","PIA/DPIA","PIA report content","PIA report contains the data of PIA completion.","N/A","N/A"
"121","232","Academia","Privacy impact assessment","Practice","Oetzel & Spiekermann (2014)","PIA/DPIA","PIA report content","PIA report contains the time frame of PIA validity.","N/A","N/A"
"122","233","Academia","Privacy impact assessment","Privacy target","Oetzel & Spiekermann (2014)","Lawfulness, fairness, and transparency","Lawfulness, fairness, and transparency","Ensuring fair and lawful processing through transparency.","N/A","N/A"
"123","236","Academia","Privacy impact assessment","Privacy target","Oetzel & Spiekermann (2014)","Processing activity","Processing activity","Ensuring limited processing for specified purpose.","N/A","N/A"
"124","237","Academia","Privacy impact assessment","Privacy target","Oetzel & Spiekermann (2014)","Data management","Data management","Ensuring data avoidance.","N/A","N/A"
"125","241","Academia","Privacy impact assessment","Privacy target","Oetzel & Spiekermann (2014)","Processing activity","Processing activity","Ensuring legitimacy of personal data processing.","N/A","N/A"
"126","242","Academia","Privacy impact assessment","Privacy target","Oetzel & Spiekermann (2014)","Processing activity","Processing activity","Ensuring legitimacy of sensitive personal data processing.","N/A","N/A"
"127","244","Academia","Privacy impact assessment","Privacy target","Oetzel & Spiekermann (2014)","Data subject rights","Information where personal data are not collected","Providing adequate information where data has not been obtained directly from the data subject (e.g., from third parties).","N/A","N/A"
"128","248","Academia","Privacy impact assessment","Privacy target","Oetzel & Spiekermann (2014)","Third-party privacy management","Third-party","Facilitating the notification to third parties about rectification, erasure and blocking of data.","N/A","N/A"
"129","249","Academia","Privacy impact assessment","Privacy target","Oetzel & Spiekermann (2014)","Data subject rights","Data processing restriction","Facilitating the objection to the processing of personal data.","N/A","N/A"
"130","250","Academia","Privacy impact assessment","Privacy target","Oetzel & Spiekermann (2014)","Data subject rights","Data processing restriction","Facilitating the objection to direct marketing activities.","N/A","N/A"
"131","251","Academia","Privacy impact assessment","Privacy target","Oetzel & Spiekermann (2014)","Data subject rights","Data processing restriction","Facilitating the objection to disclosure of data to third parties.","N/A","N/A"
"132","252","Academia","Privacy impact assessment","Privacy target","Oetzel & Spiekermann (2014)","Data subject rights","Automated decision-making objection","Facilitating the objection to decisions that are solely based on automated processing of data.","N/A","N/A"
"133","253","Academia","Privacy impact assessment","Privacy target","Oetzel & Spiekermann (2014)","Data subject rights","Automated decision-making objection","Facilitating the data subject's right to dispute the correctness of machine conclusions.","N/A","N/A"
"134","254","Academia","Privacy impact assessment","Privacy target","Oetzel & Spiekermann (2014)","Data processing principles","Integrity & confidentiality","Ensuring the confidentiality, integrity and availability of personal data storage, processing and transmission.","N/A","N/A"
"135","256","Academia","Privacy impact assessment","Privacy target","Oetzel & Spiekermann (2014)","Data processing principles","Accountability","Ensuring the accountability of personal data storage, processing and transmission.","N/A","N/A"
"136","257","Academia","PbD in ITS applications","Practice","Kung et al. (2011)","Data processing principles","Data minimisation","All personal data items are critically evaluated to determine if they are necessary or whether suitable data transformation can be applied.","During requirements analysis","N/A"
"137","258","Academia","PbD in ITS applications","Practice","Kung et al. (2011)","Privacy-by-design","Technology","Each processed data item and associated privacy policy is critically considered to determine whether suitable technical enforcement can be applied.","During design & implementation","N/A"
"138","259","Academia","PbD in ITS applications","Practice","Kung et al. (2011)","Data management","Data management","The set of operation data, the set of data policies, and the set of privacy enhancing technologies are mapped onto each other.","During design & implementation","N/A"
"139","263","Academia","Privacy-by-design","Practice","van Lieshout et al. (2011)","PIA/DPIA","PIA component","The PIA contains the description of the data needed.","During DPIA process","N/A"
"140","265","Academia","Privacy-by-design","Practice","van Lieshout et al. (2011)","PIA/DPIA","PIA component","The PIA contains safeguards on the quality of the data.","During DPIA process","N/A"
"141","266","Academia","Privacy-by-design","Practice","van Lieshout et al. (2011)","PIA/DPIA","PIA component","The PIA contains a description of access control.","During DPIA process","N/A"
"142","267","Academia","Privacy-by-design","Practice","van Lieshout et al. (2011)","PIA/DPIA","PIA component","The PIA contains a description of log systems.","During DPIA process","N/A"
"143","269","Academia","Privacy-by-design","Practice","van Lieshout et al. (2011)","PIA/DPIA","PIA component","The PIA contains the determination whether sensitive data are processed.","During DPIA process","N/A"
"144","270","Academia","Privacy-by-design","Practice","van Lieshout et al. (2011)","PIA/DPIA","PIA component","The PIA contains a description of additional measures in regards to sensitive data.","During DPIA process","N/A"
"145","273","Academia","Privacy-by-design","Practice","van Lieshout et al. (2011)","Privacy-by-design","Controls","Privacy enhancing tools and measures are applied.","N/A","N/A"
"146","276","Academia","Privacy-by-design","Practice","van Lieshout et al. (2011)","Audit, monitoring, & compliance","Monitoring","Business processes are regularly monitored and audited.","N/A","N/A"
"147","277","Academia","Privacy-by-design","Practice","van Lieshout et al. (2011)","Organisational privacy awareness","Roles & responsibilities","A chief privacy officer is appointed.","N/A","N/A"
"148","278","Academia","Privacy-by-design","Practice","van Lieshout et al. (2011)","Organisational privacy awareness","Roles & responsibilities","A privacy and data protection committee is appointed.","N/A","N/A"
"149","280","Academia","Privacy-by-design","Practice","van Lieshout et al. (2011)","Privacy-by-design","Privacy-by-Design","The design of the physical environment is included in the PbD process.","N/A","N/A"
"150","282","Academia","Privacy-by-design","Practice","van Lieshout et al. (2011)","Transparent information and communication for exercise of data rights","Data subject communication","Data subjects are provided transparent information regarding privacy policies and uses by the organisation through transparency tools.","N/A","N/A"
"151","283","Academia","DPbD modelling framework","Practice","Sion et al. (2020)","Privacy-by-design","Privacy-by-Design","Data protection by design is applied through a comprehensive and structured model-driven approach that supports the exhaustive modelling of data processing activities and related information elements in a systematic and structured fashion.","N/A","N/A"
"152","288","Academia","PbD in healthcare","Practice","Semantha et al. (2020)","PIA/DPIA","PIA component","PIA must address all privacy obligations, including health privacy principles (HPPs) and information protection principles (IPPs), where applicable.","During DPIA process","N/A"
"153","291","Academia","PbD in healthcare","Practice","Semantha et al. (2020)","Incident management","Incident management","Formulate an incident management regulation policy and create an expert team to manage the incidents.","Before incident","N/A"
"154","294","Academia","PbD in healthcare","Practice","Semantha et al. (2020)","Incident management","Incident management","Internalize the lessons from breach incidents, meaning instead of just finding out how things could have been completed in a better way, it demands making necessary alterations to enhance the process.","N/A","N/A"
"155","295","Academia","PbD in OSINT","Practice","Koops et al. (2013)","Privacy-by-design","Technology","Revocable privacy is implemented through PETs and architecture design, limiting personal data access unless pre-established condition are met that necessitate lawful access to the information.","Hardcoded in architecture","N/A"
"156","300","Academia","Data control by design","Practice","Belli et al. (2017)","Data subject rights","Data access","User-driven data control is employed.","N/A","N/A"
"157","305","Academia","Data control by design","Practice","Belli et al. (2017)","Lawfulness, fairness, and transparency","Consent","The consent and conditions travel with the data so that they are adhered to by every entity who gains access to the data.","N/A","N/A"
"158","306","Academia","Privacy engineering in smart grids","Practice","Fhom & Bayarou (2011)","Privacy-by-design","Requirements","Identify high-level policies that are relevant in the specific business domains in which the system-to-be will be deployed.","Requirements engineering","Engineers"
"159","307","Academia","Privacy engineering in smart grids","Practice","Fhom & Bayarou (2011)","System engineering","System modelling","The system-to-be is modelled within its environment with actors, elements and the type of privacy sensitive data.","System modelling","Engineers"
"160","308","Academia","Privacy engineering in smart grids","Practice","Fhom & Bayarou (2011)","System engineering","System modelling","The system model contains information flows between elements which are mapped to constraints defined by high-level policies.","System modelling","Engineers"
"161","310","Academia","Privacy engineering in smart grids","Practice","Fhom & Bayarou (2011)","PIA/DPIA","PIA component","The PIA contains models of potential adversaries; misuse cases describing threat scenarios for specific system functionalities.","Requirements engineering","Engineers"
"162","313","Academia","Privacy engineering in smart grids","Practice","Fhom & Bayarou (2011)","Privacy-by-design","Requirements","Selected privacy goals are balanced against the security and functional requirements.","Requirements engineering (low level)","Engineers"
"163","316","Academia","Privacy engineering in smart grids","Practice","Fhom & Bayarou (2011)","Privacy-by-design","Technology","PETs are selected from a catalogue of countermeasures while taking into account non-security criteria such as cost.","Development","Developers"
"164","317","Academia","Privacy engineering in smart grids","Practice","Fhom & Bayarou (2011)","Privacy-by-design","Technology","The selected PETs are assessed for effectiveness of the contribution to the overall provided degree of privacy by the system being deployed.","Development","Developers"
"165","324","Academia","Privacy engineering in smart grids","Practice","Fhom & Bayarou (2011)","Privacy-by-design","Technology","Technical mechanisms are implemented that allow users to give specific and informed consents or express choices as to whether and how they wish data about them to be collected and processed.","N/A","N/A"
"166","325","Academia","Privacy engineering in smart grids","Practice","Fhom & Bayarou (2011)","Privacy-by-design","Technology","Technical mechanisms are implemented that allow users to access their data so that they can correct or remove them, if needed.","N/A","N/A"
"167","326","Academia","Privacy engineering in smart grids","Practice","Fhom & Bayarou (2011)","System engineering","System development","Based on the underlying high- and low-level privacy requirements identified, technical (low-level) privacy policies are specified that are machine readable and enforceable by appropriated policy management components realizable as part of the system being developed.","Design","Designers"
"168","327","Academia","Privacy engineering in smart grids","Practice","Fhom & Bayarou (2011)","Audit, monitoring, & compliance","Auditing","Privacy-aware intrusion detection systems or audit tools are implemented to enforce policy and user preferences on the data processor.","N/A","N/A"
"169","328","Academia","DPbD architecture","Practice","Sion et al. (2019)","System engineering","Architecture","The system architecture contains a data protection viewpoint.","Architecture","Software/system architect"
"170","329","Academia","DPbD architecture","Practice","Sion et al. (2019)","System engineering","Architecture","The data protection viewpoint supports the modelling of data sets, processing purposes, lawful grounds, actors, legal roles, and data types.","Architecture","Software/system architect"
"171","330","Academia","DPbD architecture","Practice","Sion et al. (2019)","System engineering","Architecture","Data protection models in the architecture are verified for completeness and soundness.","Architecture","Software/system architect"
"172","332","Academia","Privacy-aware software development","Practice","Al-Momani et al. (2019)","Privacy-by-design","Requirements","Business requirements are elicited, privacy-violating requirements are discarded.","Requirements phase","Privacy engineer"
"173","334","Academia","Privacy-aware software development","Practice","Al-Momani et al. (2019)","System engineering","Architecture","The initial high-level system design has to be somewhat privacy-preserving.","Design","Privacy engineer"
"174","335","Academia","Privacy-aware software development","Practice","Al-Momani et al. (2019)","PIA/DPIA","PIA process & support","The initial high-level system design is analysed through a PIA for privacy preservation and regulation compliance.","Privacy analysis","Privacy engineers & legal advisors"
"175","338","Academia","Privacy-aware software development","Practice","Al-Momani et al. (2019)","System engineering","Testing","Low level privacy components are tested through unit tests.","Testing","Developers"
"176","339","Academia","Privacy-aware software development","Practice","Al-Momani et al. (2019)","System engineering","Testing","Integration testing is used to ensure the interaction of the low-level components executes as intended without posing privacy risks in the system.","Testing","System & privacy engineers"
"177","340","Academia","Privacy-aware software development","Practice","Al-Momani et al. (2019)","System engineering","Testing","System verifiers ensure that the implemented system meets both the predefined system and privacy requirements while reporting any mismatch to the corresponding team.","Testing","System & privacy engineers"
"178","341","Academia","Privacy-aware software development","Practice","Al-Momani et al. (2019)","System engineering","Testing","Acceptance testing is used to ensure that the system, which is about to be released to the public, meets the business requirements (including privacy and compliance requirements) defined at an earlier stage of development.","Testing","System & privacy engineers"
"179","342","Academia","Privacy-aware software development","Practice","Al-Momani et al. (2019)","System engineering","Maintenance","A periodical legal and technical assessment is performed after implementation to capture newly emerging requirements including privacy-related ones.","Maintenance","System & privacy engineers"
"180","343","Academia","Privacy-aware software development","Practice","Al-Momani et al. (2019)","PIA/DPIA","PIA process & support","Counter measures are selected based on correctness, integrability, and compatibility.","PIA","Privacy engineer"
"181","344","Academia","Continuous PIA","Practice","Sion et al. (2020)","PIA/DPIA","PIA process & support","Continuous risk assessment is supported by a privacy risk & compliance dashboard that provides a continuous, run-time inspection view on the system.","N/A","N/A"
"182","346","Academia","Continuous PIA","Practice","Sion et al. (2020)","Security","Breach/incident management","The impact of a breach on privacy is always assessed and reported.","Breach incident","N/A"
"183","348","Academia","Privacy compliance","Practice","Antignac et al. (2018)","System engineering","System modelling","The system is modelled in a privacy-aware DFD.","Architecture","Software architect"
"184","350","Academia","Privacy verification","Practice","Kost et al. (2011)","Privacy-by-design","Requirements","High-level privacy requirements are mapped to a detailed formal description of privacy requirements.","N/A","N/A"
"185","351","Academia","Privacy verification","Practice","Kost et al. (2011)","Privacy-by-design","Requirements","The formal requirements and formal system model are realised, including the structure and information flow.","N/A","N/A"
"186","354","Academia","Privacy requirements engineering","Practice","Martín et al. (2014)","Privacy-by-design","Requirements","A collection of roles is defined that are involved in the provision of privacy-compliant services and assigning privacy requirements to one or more of these roles.","N/A","N/A"
"187","356","Academia","Privacy requirements engineering","Practice","Martín et al. (2014)","System engineering","Strategies, tactics, & patterns","Engineers are provided an evolving catalogue of privacy patterns which instructs how to meet privacy requirements.","N/A","N/A"
"188","357","Academia","Privacy requirements engineering","Practice","Martín et al. (2014)","Privacy-by-design","Requirements","Levels of relevance of privacy requirements at the success criteria layer are defined, so that different levels of compliance can be required.","N/A","N/A"
"189","358","Academia","Privacy requirements engineering","Practice","Martín et al. (2014)","Third-party privacy management","Agreements","A privacy level agreement is made that addresses the level of privacy protection a service provider commits to undertake and maintain.","N/A","N/A"
"190","359","Academia","Privacy requirements engineering","Practice","Martín et al. (2014)","Third-party privacy management","Agreements","The privacy level agreement is part of a service level agreement.","N/A","N/A"
"191","361","Academia","Privacy/data protection engineering","Practice","Martín & Kung (2018)","System engineering","Development process","Privacy and data protection activities are integrated in the methods and workflows followed by engineers.","Software development lifecycle","Engineers"
"192","362","Academia","Privacy/data protection engineering","Practice","Martín & Kung (2018)","Environment cooperation","Environment cooperation","The organisation participates in learning from and contributing to the available body of knowledge amassed by the privacy community.","N/A","N/A"
"193","363","Academia","Privacy/data protection engineering","Practice","Martín & Kung (2018)","Audit, monitoring, & compliance","Compliance","An assurance process is in place, supporting the demonstration of compliance with regulation.","N/A","N/A"
"194","365","Academia","DPbD for cybersecurity systems","Practice","Gkotsopoulou et al. (2019)","Processing activity","Data identification & classification","It is determined whether the use of the system falls under any of the exceptions where special types of personal data can be processed.","Conceptualisation","N/A"
"195","369","Academia","DPbD for cybersecurity systems","Practice","Gkotsopoulou et al. (2019)","Data processing principles","Storage limitation","The storage limitation of processing activities is defined.","Conceptualisation","N/A"
"196","371","Academia","DPbD for cybersecurity systems","Practice","Gkotsopoulou et al. (2019)","Lawfulness, fairness, and transparency","Transparency","Plans are made for the achievement of transparency goals.","Conceptualisation","N/A"
"197","372","Academia","DPbD for cybersecurity systems","Practice","Gkotsopoulou et al. (2019)","Privacy-by-design","Requirements","Sector specific requirements are identified, i.e., certifications, codes of conduct, guidelines, etc.","Conceptualisation","N/A"
"198","373","Academia","DPbD for cybersecurity systems","Recommendation","Gkotsopoulou et al. (2019)","Lawfulness, fairness, and transparency","Consent","Consent is obtained in written (or electronic) form.","Design & Development","N/A"
"199","374","Academia","DPbD for cybersecurity systems","Practice","Gkotsopoulou et al. (2019)","Lawfulness, fairness, and transparency","Consent","Users are be able to withdraw consent at any time without negative consequences and should be facilitated to do so by technical means, as well.","Design & Development","N/A"
"200","375","Academia","DPbD for cybersecurity systems","Practice","Gkotsopoulou et al. (2019)","Privacy-by-design","Requirements","The system must ensure that other rights and  freedoms, such as freedom of expression and absence of discrimination are likewise safeguarded.","Design & Development","N/A"
"201","377","Academia","DPbD for cybersecurity systems","Practice","Gkotsopoulou et al. (2019)","Data subject rights","Data subject rights facilitation","The system and its components are designed in a way that relevant aspects of personal data processing are known to the data subjects, enabling them to make informed decisions and exercise their rights.","Design & Development","N/A"
"202","379","Academia","DPbD for cybersecurity systems","Practice","Gkotsopoulou et al. (2019)","System engineering","Strategies, tactics, & patterns","Dark patterns are avoided.","Design & Development","N/A"
"203","380","Academia","DPbD for cybersecurity systems","Practice","Gkotsopoulou et al. (2019)","Audit, monitoring, & compliance","Auditing","Documentation regarding how legal requirements have been implemented, which vulnerabilities have been discovered, and which data protection methods are used, is created.","Design & Development","N/A"
"204","388","Academia","DPbD for cybersecurity systems","Practice","Gkotsopoulou et al. (2019)","System engineering","Testing","Multilayer testing is conducted to verify that the planned DPbD measures were actually implemented and are indeed functional.","Testing","N/A"
"205","389","Academia","DPbD for cybersecurity systems","Practice","Gkotsopoulou et al. (2019)","Privacy-by-design","PbD processes","DPbD is applied with the addition of new features or any modifications in technical or organisational measures, as well as the maintenance of the system.","Maintenance","N/A"
"206","390","Academia","Security & privacy co-design","Practice","Vicini et al. (2016)","Privacy-by-design","Requirements","Needs and pain points of end-users are elicited through interview, focus groups, workshops, or brainstorming sessions.","N/A","N/A"
"207","392","Academia","Security & privacy co-design","Practice","Vicini et al. (2016)","Processing activity","Data identification & classification","Counter measures for sensitive personal data are determined.","N/A","N/A"
"208","393","Academia","Security & privacy co-design","Recommendation","Vicini et al. (2016)","Privacy-by-design","Requirements","Advice from legal/ethical experts is gained regarding requirements for sensitive personal data.","N/A","N/A"
"209","398","Academia","PbD in IoT","Guideline","Perera et al. (2020)","Data processing principles","Data minimisation","Minimise number of data sources: minimise the number of data sources used by an application.","IoT application","N/A"
"210","399","Academia","PbD in IoT","Guideline","Perera et al. (2020)","Data processing principles","Data minimisation","Minimise raw data intake: applications should reduce the amount of raw data acquired by the system.","IoT application","N/A"
"211","400","Academia","PbD in IoT","Guideline","Perera et al. (2020)","Data processing principles","Data minimisation","Minimise knowledge discovery: applications should only discover the knowledge necessary to achieve their primary objectives.","IoT application","N/A"
